{
  "schema_version": "2.0.0",
  "ledger_id": "ledger.round-04.worker-option.synthetic",
  "classification": "research-draft",
  "generated_at": "2026-09-09T00:00:00Z",
  "source_kernel_ref": {
    "artifact_path": "contracts/executable-if/fixtures/kernel.synthetic.json",
    "artifact_sha256": "sha256:733253db747384e70c472a9e8491ac43795078b0ec4a8a058e8a16dc712db83b",
    "kernel_id": "kernel.worker-option.synthetic",
    "manifest_hash": "sha256:b2c5d05c5a143ce4efe2bb75cced0851630e903cfd12b3f7c1d44ebded88fdcf",
    "evaluator_ref": {
      "id": "mind-flow.executable-if.evaluator",
      "version": "1.1.0",
      "digest": "sha256:bb1991818b6b11d15115e9bf032d73ce3d4fdd9f190cff0eaf5343929e6cd4dd",
      "schema_digest": "sha256:8a253e6732c518d0c89acb270fea214dc718ff4f7d21912a85091ccd5c54c31e",
      "implementation_digest": "sha256:bb285e8da61d5d47ede6170526e32e0214c5a4a67fe28794fca7b2e9a6e6a996",
      "conformance_vectors_digest": "sha256:aca56cdfeb4918b0183e59fec36c0cc04e087eb2d8e95ca657dbcb3d9f037a00"
    }
  },
  "source_history_ref": {
    "history_status": "complete-and-locally-validated",
    "event_count": 5,
    "tip_sequence": 5,
    "tip_event_id": "event.worker-option.merge",
    "tip_event_hash": "sha256:9abd34153eb436b49de7211348ece4f52cee390897002e6231fed04004a1ec1c",
    "operations": [
      "added",
      "narrowed",
      "definition-revised",
      "split",
      "merge"
    ],
    "event_refs": [
      {
        "sequence": 1,
        "event_id": "event.worker-option.added",
        "operation": "added",
        "event_hash": "sha256:6ca8810f19500298b6bd45d78c9d4e598e568c81eec8e262955432ee105d8460"
      },
      {
        "sequence": 2,
        "event_id": "event.worker-option.narrowed",
        "operation": "narrowed",
        "event_hash": "sha256:d780e45731d61d803c4a69dbd786f4c7ee4351a1da9651bc49400ff4b6ce25d5"
      },
      {
        "sequence": 3,
        "event_id": "event.worker-option.revised",
        "operation": "definition-revised",
        "event_hash": "sha256:71618cbe0859e8eeff30cba988855f2c8d3db3b2fa52608febb1c59f1ea39bf5"
      },
      {
        "sequence": 4,
        "event_id": "event.worker-option.split",
        "operation": "split",
        "event_hash": "sha256:7b3307bb974aa6f49ab1dd4f552e85e88046093731c2cc835353cf9c8f15a3df"
      },
      {
        "sequence": 5,
        "event_id": "event.worker-option.merge",
        "operation": "merge",
        "event_hash": "sha256:9abd34153eb436b49de7211348ece4f52cee390897002e6231fed04004a1ec1c"
      }
    ],
    "active_condition_definition_refs": [
      {
        "condition_id": "condition.worker-option.nsw",
        "definition_version": "1.0.0",
        "definition_hash": "sha256:861b22794e529605e0b0349a083f001fdfd2fbc3d13e0a8486d23d9cc972d706"
      }
    ],
    "evidence_event_count": 11,
    "evidence_tip_event_id": "evidence-event.august-review.added",
    "evidence_tip_event_hash": "sha256:cedb9cbb8748ced492c07bcf4171787b0387bad9c500977c50e23c8a524ffeb6",
    "evidence_state_hash": "sha256:617fb8470e120126137d8c7387417f63cc58e6d9a8b4fd09157727bbcf227750"
  },
  "condition_projections": [
    {
      "condition_definition_ref": {
        "condition_id": "condition.worker-option.nsw",
        "definition_version": "1.0.0",
        "definition_hash": "sha256:861b22794e529605e0b0349a083f001fdfd2fbc3d13e0a8486d23d9cc972d706"
      },
      "source_state_version": 1,
      "source_lifecycle": "active",
      "source_event_ref": {
        "sequence": 5,
        "event_id": "event.worker-option.merge",
        "operation": "merge",
        "event_hash": "sha256:9abd34153eb436b49de7211348ece4f52cee390897002e6231fed04004a1ec1c"
      },
      "proposition": "Affected workers have a credible alternative and an accessible human review route.",
      "claim": {
        "who": "Affected workers in the registered scope",
        "verb": "retain",
        "object": "a credible alternative and an accessible human review route",
        "standard": "both registered protection predicates are satisfied",
        "polarity": "affirmative",
        "period": {
          "starts_at": "2026-01-01T00:00:00Z",
          "ends_at": "2026-12-31T23:59:59Z"
        }
      },
      "scope": {
        "jurisdictions": [
          "Australia"
        ],
        "geographies": [
          "New South Wales"
        ],
        "cohorts": [
          "General Clerks",
          "Payroll Clerks"
        ],
        "services": [
          "Work transition support"
        ]
      },
      "evidence_state_ref": {
        "event_count": 11,
        "tip_event_id": "evidence-event.august-review.added",
        "tip_event_hash": "sha256:cedb9cbb8748ced492c07bcf4171787b0387bad9c500977c50e23c8a524ffeb6",
        "state_hash": "sha256:617fb8470e120126137d8c7387417f63cc58e6d9a8b4fd09157727bbcf227750"
      },
      "assessment_status": "open",
      "assessment": null,
      "unresolved_challenge_ids": []
    }
  ],
  "governance_events": [],
  "current_state": {
    "as_of_sequence": 5,
    "as_of_event_id": "event.worker-option.merge",
    "as_of_event_hash": "sha256:9abd34153eb436b49de7211348ece4f52cee390897002e6231fed04004a1ec1c",
    "evidence_state_hash": "sha256:617fb8470e120126137d8c7387417f63cc58e6d9a8b4fd09157727bbcf227750",
    "conditions": [
      {
        "condition_definition_ref": {
          "condition_id": "condition.worker-option.nsw",
          "definition_version": "1.0.0",
          "definition_hash": "sha256:861b22794e529605e0b0349a083f001fdfd2fbc3d13e0a8486d23d9cc972d706"
        },
        "source_state_version": 1,
        "source_lifecycle": "active",
        "source_event_ref": {
          "sequence": 5,
          "event_id": "event.worker-option.merge",
          "operation": "merge",
          "event_hash": "sha256:9abd34153eb436b49de7211348ece4f52cee390897002e6231fed04004a1ec1c"
        },
        "proposition": "Affected workers have a credible alternative and an accessible human review route.",
        "claim": {
          "who": "Affected workers in the registered scope",
          "verb": "retain",
          "object": "a credible alternative and an accessible human review route",
          "standard": "both registered protection predicates are satisfied",
          "polarity": "affirmative",
          "period": {
            "starts_at": "2026-01-01T00:00:00Z",
            "ends_at": "2026-12-31T23:59:59Z"
          }
        },
        "scope": {
          "jurisdictions": [
            "Australia"
          ],
          "geographies": [
            "New South Wales"
          ],
          "cohorts": [
            "General Clerks",
            "Payroll Clerks"
          ],
          "services": [
            "Work transition support"
          ]
        },
        "evidence_state_ref": {
          "event_count": 11,
          "tip_event_id": "evidence-event.august-review.added",
          "tip_event_hash": "sha256:cedb9cbb8748ced492c07bcf4171787b0387bad9c500977c50e23c8a524ffeb6",
          "state_hash": "sha256:617fb8470e120126137d8c7387417f63cc58e6d9a8b4fd09157727bbcf227750"
        },
        "assessment_status": "open",
        "assessment": null,
        "unresolved_challenge_ids": []
      }
    ]
  },
  "publication_anchor": {
    "verification_status": "not-verified-by-external-checkpoint",
    "checkpoint_uri": "https://mind-flow.org/checkpoints/unpublished/round-04",
    "source_event_count": 5,
    "tip_event_id": "event.worker-option.merge",
    "tip_event_hash": "sha256:9abd34153eb436b49de7211348ece4f52cee390897002e6231fed04004a1ec1c"
  },
  "public_projection": {
    "history": {
      "status": "complete-source-bound",
      "change_count": 5,
      "operations": [
        "added",
        "narrowed",
        "definition-revised",
        "split",
        "merge"
      ],
      "notice": "The executable IF kernel owns definition history. This overlay binds that complete local history and opens no empirical assessment."
    },
    "active_conditions": [
      {
        "condition_definition_ref": {
          "condition_id": "condition.worker-option.nsw",
          "definition_version": "1.0.0",
          "definition_hash": "sha256:861b22794e529605e0b0349a083f001fdfd2fbc3d13e0a8486d23d9cc972d706"
        },
        "proposition": "Affected workers have a credible alternative and an accessible human review route.",
        "claim": {
          "who": "Affected workers in the registered scope",
          "verb": "retain",
          "object": "a credible alternative and an accessible human review route",
          "standard": "both registered protection predicates are satisfied",
          "polarity": "affirmative",
          "period": {
            "starts_at": "2026-01-01T00:00:00Z",
            "ends_at": "2026-12-31T23:59:59Z"
          }
        },
        "scope": {
          "jurisdictions": [
            "Australia"
          ],
          "geographies": [
            "New South Wales"
          ],
          "cohorts": [
            "General Clerks",
            "Payroll Clerks"
          ],
          "services": [
            "Work transition support"
          ]
        },
        "assessment_status": "open"
      }
    ],
    "boundaries": {
      "mechanical_rule_state_is_empirical_truth": false,
      "authority_granted": false,
      "action_authorised": false
    }
  },
  "manifest_hash": "sha256:bbf276ed3f9acb1e60293b90660dfde4f8ba40ff64f1900f2bd6b245b83a219a",
  "contract_boundary": {
    "definition_history_owner": "source-executable-if-kernel",
    "history_validity_effect": "source-binding-and-integrity-only",
    "condition_truth_effect": "none",
    "authority_effect": "none",
    "action_authorisation_effect": "none"
  }
}
