{
  "schema_version": "2.0.0",
  "ledger_id": "ledger.kernel.nero.5311.102.prospective.assessment-overlay",
  "classification": "research-draft",
  "generated_at": "2026-09-10T00:00:41Z",
  "source_kernel_ref": {
    "artifact_path": "forecasts/prospective-pilot/round-09-nero/kernel.json",
    "artifact_sha256": "sha256:c6fcdea15b24f6e62a4eab75c10b29c7f23fa107f3f9e96fdbd53dfcb813a55d",
    "kernel_id": "kernel.nero.5311.102.prospective",
    "manifest_hash": "sha256:36c02d95f5d15c251d11753046f8b845a9e7cc25fce4c820d4019d8ca7345f6d",
    "evaluator_ref": {
      "id": "mind-flow.executable-if.evaluator",
      "version": "1.1.0",
      "digest": "sha256:bb1991818b6b11d15115e9bf032d73ce3d4fdd9f190cff0eaf5343929e6cd4dd",
      "schema_digest": "sha256:8a253e6732c518d0c89acb270fea214dc718ff4f7d21912a85091ccd5c54c31e",
      "implementation_digest": "sha256:bb285e8da61d5d47ede6170526e32e0214c5a4a67fe28794fca7b2e9a6e6a996",
      "conformance_vectors_digest": "sha256:aca56cdfeb4918b0183e59fec36c0cc04e087eb2d8e95ca657dbcb3d9f037a00"
    }
  },
  "source_history_ref": {
    "history_status": "complete-and-locally-validated",
    "event_count": 1,
    "tip_sequence": 1,
    "tip_event_id": "event.nero.5311.102.stock.added",
    "tip_event_hash": "sha256:65c724bcd81f5ee922c535ca7022d4e66c1df6efee23cd4b3bc388737202c709",
    "operations": [
      "added"
    ],
    "event_refs": [
      {
        "sequence": 1,
        "event_id": "event.nero.5311.102.stock.added",
        "operation": "added",
        "event_hash": "sha256:65c724bcd81f5ee922c535ca7022d4e66c1df6efee23cd4b3bc388737202c709"
      }
    ],
    "active_condition_definition_refs": [
      {
        "condition_id": "condition.nero.5311.102.stock",
        "definition_version": "1.0.0",
        "definition_hash": "sha256:6dac7075fa5a8d429d5e1469d383bc0085027f32b3569526a6e65acb840bb548"
      }
    ],
    "evidence_event_count": 1,
    "evidence_tip_event_id": "evidence-event.nero.5311.102.2026-08.added",
    "evidence_tip_event_hash": "sha256:c98a0bc43f5a2278c3005b4717eef11dae71d77077df32997f31b1adf20024d5",
    "evidence_state_hash": "sha256:b455ad0986bc17fcae839ab8a24805ba8e87c44a816e359ced73d34b48a33c36"
  },
  "condition_projections": [
    {
      "condition_definition_ref": {
        "condition_id": "condition.nero.5311.102.stock",
        "definition_version": "1.0.0",
        "definition_hash": "sha256:6dac7075fa5a8d429d5e1469d383bc0085027f32b3569526a6e65acb840bb548"
      },
      "source_state_version": 1,
      "source_lifecycle": "active",
      "source_event_ref": {
        "sequence": 1,
        "event_id": "event.nero.5311.102.stock.added",
        "operation": "added",
        "event_hash": "sha256:65c724bcd81f5ee922c535ca7022d4e66c1df6efee23cd4b3bc388737202c709"
      },
      "proposition": "The modelled employment stock is at least the frozen August 2026 count 3092; this is exposure context only.",
      "claim": {
        "who": "NERO occupation code 5311, General Clerks, resident in SA4 code 102, Central Coast",
        "verb": "have",
        "object": "modelled employment stock at or above 3092",
        "standard": "bounded employment index x/(x+3092) is at least 0.5",
        "polarity": "affirmative",
        "period": {
          "starts_at": "2026-08-01T00:00:00Z",
          "ends_at": "2026-10-31T23:59:59Z"
        }
      },
      "scope": {
        "jurisdictions": [
          "Australia"
        ],
        "geographies": [
          "SA4 102: Central Coast"
        ],
        "cohorts": [
          "ANZSCO4 5311: General Clerks"
        ],
        "services": [
          "Modelled employment stock, exposure context only"
        ]
      },
      "evidence_state_ref": {
        "event_count": 1,
        "tip_event_id": "evidence-event.nero.5311.102.2026-08.added",
        "tip_event_hash": "sha256:c98a0bc43f5a2278c3005b4717eef11dae71d77077df32997f31b1adf20024d5",
        "state_hash": "sha256:b455ad0986bc17fcae839ab8a24805ba8e87c44a816e359ced73d34b48a33c36"
      },
      "assessment_status": "open",
      "assessment": null,
      "unresolved_challenge_ids": []
    }
  ],
  "governance_events": [],
  "current_state": {
    "as_of_sequence": 1,
    "as_of_event_id": "event.nero.5311.102.stock.added",
    "as_of_event_hash": "sha256:65c724bcd81f5ee922c535ca7022d4e66c1df6efee23cd4b3bc388737202c709",
    "evidence_state_hash": "sha256:b455ad0986bc17fcae839ab8a24805ba8e87c44a816e359ced73d34b48a33c36",
    "conditions": [
      {
        "condition_definition_ref": {
          "condition_id": "condition.nero.5311.102.stock",
          "definition_version": "1.0.0",
          "definition_hash": "sha256:6dac7075fa5a8d429d5e1469d383bc0085027f32b3569526a6e65acb840bb548"
        },
        "source_state_version": 1,
        "source_lifecycle": "active",
        "source_event_ref": {
          "sequence": 1,
          "event_id": "event.nero.5311.102.stock.added",
          "operation": "added",
          "event_hash": "sha256:65c724bcd81f5ee922c535ca7022d4e66c1df6efee23cd4b3bc388737202c709"
        },
        "proposition": "The modelled employment stock is at least the frozen August 2026 count 3092; this is exposure context only.",
        "claim": {
          "who": "NERO occupation code 5311, General Clerks, resident in SA4 code 102, Central Coast",
          "verb": "have",
          "object": "modelled employment stock at or above 3092",
          "standard": "bounded employment index x/(x+3092) is at least 0.5",
          "polarity": "affirmative",
          "period": {
            "starts_at": "2026-08-01T00:00:00Z",
            "ends_at": "2026-10-31T23:59:59Z"
          }
        },
        "scope": {
          "jurisdictions": [
            "Australia"
          ],
          "geographies": [
            "SA4 102: Central Coast"
          ],
          "cohorts": [
            "ANZSCO4 5311: General Clerks"
          ],
          "services": [
            "Modelled employment stock, exposure context only"
          ]
        },
        "evidence_state_ref": {
          "event_count": 1,
          "tip_event_id": "evidence-event.nero.5311.102.2026-08.added",
          "tip_event_hash": "sha256:c98a0bc43f5a2278c3005b4717eef11dae71d77077df32997f31b1adf20024d5",
          "state_hash": "sha256:b455ad0986bc17fcae839ab8a24805ba8e87c44a816e359ced73d34b48a33c36"
        },
        "assessment_status": "open",
        "assessment": null,
        "unresolved_challenge_ids": []
      }
    ]
  },
  "publication_anchor": {
    "verification_status": "not-verified-by-external-checkpoint",
    "checkpoint_uri": "https://mind-flow.org/checkpoints/unpublished/round-04",
    "source_event_count": 1,
    "tip_event_id": "event.nero.5311.102.stock.added",
    "tip_event_hash": "sha256:65c724bcd81f5ee922c535ca7022d4e66c1df6efee23cd4b3bc388737202c709"
  },
  "public_projection": {
    "history": {
      "status": "complete-source-bound",
      "change_count": 1,
      "operations": [
        "added"
      ],
      "notice": "The executable IF kernel owns definition history. This overlay binds that complete local history and opens no empirical assessment."
    },
    "active_conditions": [
      {
        "condition_definition_ref": {
          "condition_id": "condition.nero.5311.102.stock",
          "definition_version": "1.0.0",
          "definition_hash": "sha256:6dac7075fa5a8d429d5e1469d383bc0085027f32b3569526a6e65acb840bb548"
        },
        "proposition": "The modelled employment stock is at least the frozen August 2026 count 3092; this is exposure context only.",
        "claim": {
          "who": "NERO occupation code 5311, General Clerks, resident in SA4 code 102, Central Coast",
          "verb": "have",
          "object": "modelled employment stock at or above 3092",
          "standard": "bounded employment index x/(x+3092) is at least 0.5",
          "polarity": "affirmative",
          "period": {
            "starts_at": "2026-08-01T00:00:00Z",
            "ends_at": "2026-10-31T23:59:59Z"
          }
        },
        "scope": {
          "jurisdictions": [
            "Australia"
          ],
          "geographies": [
            "SA4 102: Central Coast"
          ],
          "cohorts": [
            "ANZSCO4 5311: General Clerks"
          ],
          "services": [
            "Modelled employment stock, exposure context only"
          ]
        },
        "assessment_status": "open"
      }
    ],
    "boundaries": {
      "mechanical_rule_state_is_empirical_truth": false,
      "authority_granted": false,
      "action_authorised": false
    }
  },
  "manifest_hash": "sha256:5cb27366418bd8ec1d2b3568ff07fbb852796b86b49b4d0d99877bd3910b3aed",
  "contract_boundary": {
    "definition_history_owner": "source-executable-if-kernel",
    "history_validity_effect": "source-binding-and-integrity-only",
    "condition_truth_effect": "none",
    "authority_effect": "none",
    "action_authorisation_effect": "none"
  }
}
